<?xml version="1.0"?>

<cuboids
xmlns:xsi="http://www.w3.org/2001/XMLSchema-instance"
xsi:noNamespaceSchemaLocation="InputCuboids.xsd">
	
	<cuboid>
		<meshWidth>1.2</meshWidth>
		<mass>1.0</mass>
		<meanV>0.1</meanV>
		<parTypeC>0</parTypeC>
		 
		<epsilon>1.0</epsilon>
		<sigma>1.0</sigma>		
		
		<originVector>
			<oriX>0.6</oriX>
			<oriY>2.0</oriY>
			<oriZ>0.0</oriZ>
		</originVector>
		<startVelocity>
			<velX>0.0</velX>
			<velY>0.0</velY>
			<velZ>0.0</velZ>
		</startVelocity>
		<size3D>
			<width>50</width>
			<height>14</height>
			<depth>1</depth>
		</size3D>
	</cuboid>	
	
	<cuboid>
		<meshWidth>1.2</meshWidth>
		<mass>2.0</mass>
		<meanV>0.1</meanV>
		<parTypeC>1</parTypeC>
		 
		<epsilon>1.0</epsilon>
		<sigma>0.9412</sigma>		
		
		<originVector>
			<oriX>0.6</oriX>
			<oriY>19</oriY>
			<oriZ>0.0</oriZ>
		</originVector>
		<startVelocity>
			<velX>0.0</velX>
			<velY>0.0</velY>
			<velZ>0.0</velZ>
		</startVelocity>
		<size3D>
			<width>50</width>
			<height>14</height>
			<depth>1</depth>
		</size3D>
	</cuboid>
</cuboids> 
